,index,dates,place_names,tweets,long,lat,clean_tweets,polarity_cl,polarity
0,0,2016-10-20 01:04:24.693,,Alright let's get this shit show started! Pre debate prediction: Trump shows up drunk and tries to grope Chris Wallace.,,,alright lets get this shit show started pre debate prediction trump shows up drunk and tries to grope chris wallace,2,2
1,1,2016-10-20 01:04:24.571,,RT @TheRickWilson: Bottom. Hit. https://t.co/A1ZKQQdUoi,,, bottom hit,2,2
2,2,2016-10-20 01:04:24.642,,RT @keke_lafleur: Hillary rocking the white power suit like... #debate https://t.co/ebT8M2Hge0,,, hillary rocking the white power suit like 0,2,2
3,3,2016-10-20 01:04:24.587,,Live tweeting tonight's debate. Follow along! #RedNationRising #presidentialdebate #Debate2016,,,live tweeting tonights debate follow along,2,2
4,4,2016-10-20 01:04:24.633,,"RT @dog_rates: This is Lucy. She destroyed not one, but two remotes trying to turn off the debate. 11/10 relatable af https://t.co/3BXh073t…",,, this is lucy she destroyed not one but two remotes trying to turn off the debate /10 relatable af,0,2
5,5,2016-10-20 01:04:24.679,,Final conflict: Trump battles Hillary in 3rd debate https://t.co/wWxfyVro0C #HillaryNO #Hillary2016,,,final conflict trump battles hillary in rd debate 0c,2,2
